{
  "claims": [
    "Computed overlap matrix rank ovrank_Rstar over F2",
    "Computed corank_Rstar as max local restricted-cycle rank over F2",
    "WL1 proxy homogeneity flag recorded"
  ],
  "computed": {
    "corank_Rstar": 10,
    "cycle_rank": 10,
    "overlap_matrix_shape": [
      10,
      10
    ],
    "ovrank_Rstar": 3,
    "wl1_homogeneous_proxy": true
  },
  "graph": {
    "edges": [
      [
        6,
        15
      ],
      [
        12,
        16
      ],
      [
        5,
        7
      ],
      [
        3,
        16
      ],
      [
        8,
        9
      ],
      [
        10,
        12
      ],
      [
        1,
        9
      ],
      [
        1,
        3
      ],
      [
        2,
        8
      ],
      [
        13,
        14
      ],
      [
        2,
        17
      ],
      [
        15,
        17
      ],
      [
        4,
        5
      ],
      [
        14,
        15
      ],
      [
        8,
        14
      ],
      [
        0,
        4
      ],
      [
        0,
        13
      ],
      [
        11,
        13
      ],
      [
        2,
        10
      ],
      [
        6,
        16
      ],
      [
        4,
        7
      ],
      [
        3,
        11
      ],
      [
        5,
        17
      ],
      [
        0,
        12
      ],
      [
        1,
        10
      ],
      [
        7,
        11
      ],
      [
        6,
        9
      ]
    ],
    "n": 18
  },
  "meta": {
    "created_utc": "2026-02-20T16:39:37.368562Z",
    "id": "CYCLONE_CAND_18_3_4_2_13",
    "tool_version": "tools/cyclone/overlap_rank.py:v1"
  },
  "params": {
    "Delta": 3,
    "Rstar": 2,
    "equivalence_proxy": "WL1_homogeneity_on_r_rounds",
    "k": 4,
    "r": 2
  }
}